title,upvotes
Anyone else so disheartened by all the recent back sliding?,245
"As an adjunct who’s watched three years of I/O M.A. students struggle to find jobs, its a problem.",153
"US Executive Order calls for ending ""disparate impact liability""",141
Harvard has revoked tenure from Francesca Gino,126
Job market is so bad,116
My People Analytics job hunt,102
SPSS is good enough for me and my job.,90
"Can we just admit it? I-O master’s programs have drifted into a direct continuation of the general psych B.A., promising that two more graduate years (on top of a four-year degree) will create an all-purpose “workplace scientist.” That pitch is unrealistic and predatory, and the programs know it.",78
Hiring People Analytics Analyst,61
Potentially Unpopular Opinion/Expressing Concern,60
Why does it seem that so many folks here are against the idea of pursuing IO?,58
Job Applicants Sue A.I. Recruitment Tool Company,58
Regretting my I/O MS; Can’t find work; Advice on next steps,56
What big things have we learned in the past 20 years?,56
Class of 2025/2026 - How can I help?,55
Truth of why nobody’s buying or investing in IO psych,54
Thoughts on the I-O certificate announced by SIOP?,52
Community Build: Practical Guide to Getting Your First Applied I/O Job,52
"Introducing the The Synthetic Nomological Net: A search engine to find 74,000+ scales in psychology",47
Judge allows Workday AI bias lawsuit to proceed as collective action,49
"SIOP’s “Rule of Three” for thee, not for me?",47
Do entry level opportunities in IO exist anymore?,49
You are cordially invited to the 4TH ANNUAL IO Psychology Discord Meetup,48
[OC] I/O Psychology Salary Before and After Adjustment for Cost Of Living by State,47
Ph.D. Holder Can't Find a Job,44
Sharing an applied IO role and hoping to reach more of the IO community,40
If I were pursuing an I-O program today…,39
Frustrations explaining what IO is,38
ODU removes IO programs,38
Can’t find my footing,39
Come work with me this summer at Roblox! People Science - PhD Internship,36
What areas of IO Psychology are you most passionate about and why?,38
"Poster accepted at SIOP, by reviewer feedback was clearly for a different submission",34
Would you take this job as an I-O psych grad?,33
Feeling Stuck/Unhireable,34
Welp. I contacted my buddy from grad school. He still hasn't found anything even after 5 1/2 years....,33
What are some jobs other than HR and what’s their salary?,33
What are some adjacent job titles I can search for that might not be 100% related to IO but close enough where an I/O MA would still be somewhat relevant,31
Breaking into I/O,30
for phds.. regrets on doing a phd?,30
Is I-O psychology still relevant in 2026?,28
New PhD feeling unsure about applied job market,28
What’s the #1 challenge stopping HR from shaping company culture where you work?,27
"For anyone that got an I/O degree for the security of a job, rather than the passion for the field, what are you doing?",26
Psychometricians Discord Community,26
Finding a job,26
SIOP releasing my personal info?,23
What did you do with your M.S. I-O degree when you first graduated?,24
Do practicing I/O Psychologists actually use the Big Five (OCEAN)?,24
scared i have committed to traditional hr,23
Where are the entry-level experience roles for IO psychologists heading?,23
Looking for Current/Prospective student's to apply to our PhD Program. Binghamton University PhD in Management,24
What is bad in the job market and why?,23
r/psychometrics has reopened! I'm the new moderator!,23
Purdue I-O PhD Virtual Info Session,22
Looking to connect with peers,21
Anyone have a headhunter referral?,21
What are some negative traits you’ve seen from people who don’t go far in your field?,21
Reflective Question for Fellow I-O Practitioners: What Commonly Accepted Practices Have You Seen Cause Unintended Harm?,20
I/O Psychologists’ ROI for a company?,20
What motivated you to choose I/O psychology compared to other fields of psychology?,20
Transition from people analytics to business analytics (and back),19
Is IO more of a focus on Human Resources or Psychology,21
Job Advice for M.S. IOP,19
Lost in I/O Psych - Update,18
A.I Taking Over,20
2026 SIOP Decisions ?,16
Launching a A Community Dedicated to Survey Fraud Detection,17
Data Analysts,19
Question about the reality of organizational psych. Need help,17
Are data analyst certifications worth it?,17
skills to brush up on,18
Career Advice as an Unsure PhD,16
"New Research: How ""Digital Climate"" Impacts Employee Wellbeing During Digital Transformation",17
What are some of the must-read classic articles in the field of organizational behavior?,16
This is like that Edwardo Salas article all over again,15
"Talent Management Program Manager in Cupertino, CA",15
Is I/O Psych good for Organizational Development,16
When someone says IO Psych? So... like therapy at work?,15
Where do you see the biggest disconnect between IO research and People Analytics practice?,15
Will a Master's In IO Psychology Be Worth It?,15
Must read books to understand/work with blue collar workers?,16
State of debate/research on manager effectiveness &amp; manager-employee relationship?,15
Why ruthless characters rise at work and why some managers choose them,14
Are there any organizational leaders here who have been impacted by DEI backlash and retrenchment policies? [United Stated],16
I/O Psychology Career Paths,14
OPM formally proposes limiting top performance ratings for federal workers,13
Need career advice,15
Question re the tech stack used regularly as an I/O Psych,14
Regarding AI and Learning &amp; Development,15
Good podcasts on IO Psych?,15
IO Psych job market?,13
"About to graduate my master's in IO, any recommendations for essential readings for people entering the job market?",14
"IO psychology openhouse at Montclair State University, Oct 26",14
How to Break Into the I/O Psychology Field,15
Current IO professionals: How much do you use what you learned?,14
Where to start with freelancing / independent consulting?,13
Internship Help,11
Single (not poster) SIOP submissions - worth pursuing?,12
Edgar Schein's Organizational Culture Model and underlying assumptions,14
Best part-time job roles for someone transferring into a Psych BA and aiming for I/O Psych?,13
How to not lose your humanity for the people in the organization,13
Career change,13
SIOP,14
PhD in I/O Psychology vs PhD in Organizational Behavior,13
Share your success story? Feeling behind and anxious about PhD,13
how can you begin to build a safe and respectful workplace in a violent and toxic enviroment?,13
Part Time IO Work?,12
Master’s Thesis Struggle 😭,13
Are Certifications Worth It?,12
I/O Psychology folks from India!,13
What do you believe is the most helpful textbook or resource in learning organizational psychology?,12
What type of consulting for IO Psychologist?,13
Let Me In,12
Advice for autistic early-career I/Os?,11
is it okay to dislike an internship experience?,13
is getting your PhD worth it?,12
Perceived Fairness,13
Current undergrad exploring I/O,12
I can't do clinical psychology 😭😭,12
Looking for Brutally Honest Career Advice,9
I/O Psych bachelor’s + L&amp;D experience—what roles should I realistically be targeting?,12
Practical experience,11
Has anyone ever used this tool called Deeper Signals?,11
Where do I find Research opportunities?,11
Org obligations &amp; liabilities re: specific legal concerns being disclosed on anonymous survey - need advise/perspective,11
Industrial Organizational Psychology VS Counselling Psychology,10
What's your day-to-day like in your IO specialty?,11
"Do you guys have mentors? If yes, how did you go about finding one? And how much impact has having a mentor had on you and your career?",11
IO job search help,11
Submit to SIOP Pre-Conference Research Community Forums!,11
Is pursuing a masters in I/O the correct decision?,12
Confused,11
How do I break in and get my foot in the door?,11
How I think about the question about breaking into the IO psychology field,11
Incoming Graduate Student!!,11
Preparing for a Sr. People Analytics Consultant interview!,12
Sources For Salary Negotiation?,12
ChatGPT has become an IO psychologist,9
Seeking career advice,9
"I need to interview an I/O Psychologist, Can someone in the Profession help please ?",10
Is it risky too pursue masters in I/O Psychology?,9
New Physician Leader: Building a Team and Seeking Your Advice,11
Asking for Informational Interviews/Coffee Chats,11
Essential home library reference texts,10
Better Upward Mobility: MSIO or HRM Masters,9
Required Time Off,11
Prevalence of Personality Disorders,9
FIOP Event: Collaboration and Creativity at NASA,9
Anyone here interviewed for a Change Management Consultant role at BDO?,10
"In final year of Masters program, how far in advance to apply for jobs?",9
Is IO Psychology a good mix with B.S. in Computer Science and an MBA?,9
Feeling like my PhD maybe useless,9
Recommended readings on performance review content,9
Consulting &amp; I/O,10
"Graduating Soon, and Looking for Work/ Help. MD/ D.C. Local,",8
Is it possible to get into hr or people analytics while studying i/o psychology masters distance?,7
"Bi-Weekly /r/IOpsychology Discussion - What have you been reading, and what do you think of it?",7
Looking for advice: Should I give my opinions on process improvements etc. before leaving my job?,10
Communication in the workplace,7
Is IO masters worth it when going into analysis/HR industry?,10
Early Career Advice,9
Advice Needed: Best Master’s Path After a BS in Psychology,8
Personnel Selection &amp; Assessment Help!,8
Career/Grad School Help!,8
IO Psychology and Job Applications,8
SIOP 2026 - thoughts?,8
About to Have My Baby &amp; Finish My Psych Degree(Bach) .Stuck between Rad Tech or I/O Master's in Houston? Need Real Salaries 🙏,9
Book recommendations,7
Free Conference at NYU,8
Continuous overall scores but categorical subscales,6
We measured how often real applicants use GenAI on pre-hire assessments (and if warnings actually stop them),7
Study abroad changes my post-grad plans..advice?,7
how can I better equip myself for working in I/O ?,9
Need help conducting my first employee survey,7
Assistantship funding question,8
Feeling hopeless trying to land an IO job in the UK. Need advice,6
Certified Wellness Practitioner??,6
How competitive is the I/O Psychology job market?,6
Feeling lost with my SOP/ Motivation Letter,7
Career/Academic Guidance with IO and AI,7
SIOP Board Elections Now Open,7
Employee Recognition Program,8
I’m in the interview process for a finance job and the last step is talking to an Industrial Psychologist.  Any advice?,7
Trying to discern the appropriate degree but I feel like it's a Catch-22,7
Looking for help with Onboarding,6
October Consortium Dress Code,7
Advice and Questions,7
Can I get into PhD/PsyD?,8
Career Advice,7
"If you could design your own I/O-focused undergrad program, what would you include?",5
UPSKILL query,7
Org Psychs in Australia/Vic – Career Insights?,7
Newcomer,5
The Performance Review Crisis: Evaluating Proficiency in the New Era,6
I’m looking to change majors and my school offers a bachelor business administration with a concentration of IO Psychology. What possibilities would open up?,6
Scales to measure inclusion,5
Possible webinar on AI survey fraud. What questions should it cover?,7
Built an LLM-driven vocational assessment system for neurodivergent populations — looking for specialist critique,5
Internships between undergrad and grad school,7
What is the best strategy for creating a wellness survey that only allows 3 questions?,6
Upskilling suggestions to get into consulting ultimately,5
Should I pursue IO psychology straight out of undergrad or should I gain experience first?,6
Strategic Workforce Planning,7
People working in Organizational : what does your day-to-day actually look like?,6
Considering I/O psyc or something similar 101. Looking for input.,6
Psychological Preferences in Job Choice: Growth vs Security &amp; Fixed vs Variable Pay (Analysis of 130 Survey Responses),6
Seeking Advice on Remote Internships for a Recent Graduate,7
Need guidance about my future carrier,6
Looking for advice with onboarding,7
Do I need a masters in I/O?,6
Occupational Health Psychology,5
AI Courses/Certifications,6
Recent Psychology BS Grad looking for advice/info about the field!,5
Data Cleaning &amp; Analysis - Asking for Thesis Advisor Help?,5
Is Organizational Psychology the same as Industrial Organizational Psychology,6
I got Hogan Certified,7
Career Search Milwaukee Area,5
"Clinical Psychology, I/O Psychology, and MBA (India) – need honest advice",5
Bachelor's Dregree Jobs,5
FIOP Event: Career Transitions,5
Engineering Student Seeking Best Practices for Studying I/O Psychology,3
International conference alternatives to SIOP?,6
Psychological experiments / videos that can be linked to safety behavior at work (production environment),5
Help with testing for recruiting,4
New Skills/certificate courses to acquire into Learning and Development,6
Outcomes data on performance management,5
what does the job market for IOP look like in New Zealand?,4
I/O masters- worth it?,4
Statistics Courses,5
SIOP 2026 submissions,6
IO Psychology vs Psychology,6
Should I be concerned about my sub-par GRE score for PhD apps?,5
Claremon PsyD in Org Psych Acceptance,5
Media discourse patterns predict organizational reform success: Analysis of military training accidents reveals how public narratives shape institutional learning,5
Searching Remote Research Opportunity to Strengthen PhD Application (IO Psych &amp; OB),5
Is I/O Right For Me?,5
Insight? Should I get my doctorate in I/O Psychology,4
Feedback on qualitative analytics tool,6
Is there room for stock market behavior/finance in IO? Considering studying this field,6
IO at SPSSI,5
IO-PHD admits- what was your GRE Score?,5
What skills do you actually need to get into people analytics?,4
Job market internationally,6
"If everyone has AI tools, why are only a few employees seeing real productivity gains?",4
Can Io psychology lead to market research and consumer psychology?,3
Exploring I/O Psychology Career Opportunities in the Federal Government,4
Career Path Advice,4
I/O Background to Safety,4
Breaking into IO Psych in NZ?,4
What roles in IO Psych are mostly people facing?,5
Book recommendations?,5
Any IO psych or OD side gigs/local group,4
New Move/ Job Search,4
Need career advice 🚨,5
I/Os: What are the biggest bottlenecks in assessment development and validation?,4
Certification,4
New research on how algorithmic systems transform memory and identity formation,5
Internship post undergrad,3
Career advice please 🙏,4
Question - Applying for Jobs,4
Do not discourage empathetic I/O Psychologists or students,4
HR Certification or No?,4
Is there a best school for people analytics?,3
What's the mindset?,5
Looking for advise for work within I/O Psychology,3
[US] Job market for international students/graduates,5
"Just finished undergrad in psychology, starting MSc in Occupational &amp; Organisational Psychology at Liverpool this September. Want to get into HR. Any advice?",5
Advancing in Career,2
Preparing for A Career,4
"SIOP ""Consultant Locator"" Courtesies",5
Data “?’s” from an undergrad,3
Hi all interview,3
Help with Job Hunting for after MSIO graduation,4
Working with individuals,3
Which role in IO psychology or related to it is not much people facing and I get to work on behind the scene?,3
Data quality issues on online panels,3
Do I need to go back to school to get into IO Psych?,3
Advice on balancing academic rigor with user friendliness,3
Hs senior needs advice on classes,3
Considering IO Psychology,3
Graduate School Dilemma,3
Would a masters in io make sense for me as a marketer at a law firm that doesn’t have structure?,3
When did you know what you wanted to do?,3
ma in i/o or mba?,3
Advice for I/O Psychology Masters,3
Working in I/O Psych with another specialty,3
What is the view of IO psychology of workplace participation by employees ?,3
Recent I/O Psych BS Graduate,3
Stupid question of the week,4
What certifications (if any) are worth getting for industry work?,3
Need advice on transitioning to I/O Psychology,3
Next steps after undergrad - advice?,3
Need serious help with internship project!,2
Want to know about I/O psychologist.... Thinking of becoming one,3
general job analysis questions,3
“Optional” Performance Feedback?,3
Question/Advice,2
Psychology Crisis,1
TEDx and Other Speaking Opportunities,1
How to pivot after Interview &amp; Candidate Assessment role,2
Learning Public Health / Organizational Psychology,2
SIOP Decisions,2
Entry level jobs for non graduate degree holders in IO Psych?,2
Are there any non-graduate degree options for someone with experience?,2
Job?,3
Job Search Advice,2
Advice on membership networking platforms,2
Prevalence and future of IO jobs in East and South East Asia?,2
Workplace,2
"exploring IO for my masters, need some advice!",2
Career future with IO Master degree in EU countries?,2
Program Directory,2
Advice for my career path?,2
"Starting my masters in counseling, but want to switch to io psychology",2
IO Psych Grad from India Seeking Global Career Guidance,3
Organization chart for 3D companies,2
Standard Resume and Education &amp; Experience Exams,2
Planning Independent Research in Final Year. Will It Help for Master's Scholarships?,2
Online degrees - Good idea or waste of time?,3
Good resources to recap on survey item analysis?,2
What kind of consulting jobs can you get w a masters?,2
Question on submissions for and/or presenting at SIOP,1
Single Courses with Practical Application,1
For students interested in I/O Psychology Graduate School,1
Questions for those currently working in I/O Psych,1
The Impact of Social and Informational Biases on Job-Search Decision-Making,1
"How long is ""lately"" in ""what have you done for me lately?""",2
Looking for help,1
Career advice,1
Capstone Project Anxiety,1
SIOP submission,1
Possible IO Masters?,1
"Good people of this subreddit, I need your help!",1
Generational differences in negotiation &amp; conflict - how are orgs actually addressing this?,1
Marketing for an organizational psychology consultation business,1
Seeking Remote Research Opportunity to Strengthen PhD Application (I/O Psych / OB / Workplace Inclusion),1
How realistic is it to pivot to an OB PhD after b-school with no research experience?,1
Thesis Dilemma,1
experience building,1
Hi! Undergrad right now with a major in psych!,1
Advice for a Hopeful I/O Psychology Student?,1
Need help as a foreign student,1
I/O Psychology job opportunities in India,2
I/O psychology research assistanship,1
IO and Fashion,1
Entry level services for new Organizational psychologist in 2026?,0
Most people don't know what I/O Psych is,0
Business Psych major or do I stay a Psych major?,0
just graduated,0
Best platform for io psychology online,0
Does anyone have a PDF copy of Industrial/Organizational Psychology: Understanding the Workplace?,0
Please help me out!,0
IO psychology scope in India,0
O/I Psych cert/degree considerations,0
Need Some Advice,1
🎓 Current I-O Psychology Grad Student Seeking Real-World Insight — Is This the Right Career Path?,2
I/O psychologist!! Few questions,0
Searching for a postdoc where I can study female-female rivalry in the workplace?,0
How Is The Work,0
I/O Jobs,0
EO 14281 and Meritocracy: Are Organizations Finally Free to Hire the Best?,0
Free Hogan Personality Test legitimate?,0
"AMA - HR Director, Hiring Manager, ATS Owner",0
"Job opportunities,salaries etc.",0
self-report instrument to assess executive functions,0
What should I expect from a psychological assessment for a job?,0
Contractions by Mike Bartlett,0
Help me think through a pathway,0
"Ha senso fare un master in psicologia del lavoro, I/O, Risorse umane dopo una magistrale in psicologia clinica?",0
What makes an IO Psychologist a psychologist?,0
ChatGPT to create/test surveys?,0
Looking for an Industrial Psychologist in Thailand or Singapore,0
Best AI for analyses?,0
I want in (and out),0
Thoughts on this? I recently used ChatGPT to help me create job descriptions. It felt like cheating!,0
Why do a few people run with AI while most don’t?,0
"Master’s thesis in psychoanalysis topic. Please help out with some topics, titles, especially if you work I the field. I want to keeep it mainly theoretical, without the presentation of my cases",0
Fresh Graduate. Next Steps In zny Joirney,0
Advice from ye elders please 🙏,0
Looking for internship Spring 2026,0
IO Psychology entrance exam prep,0
I need someone who works in the field of IO Psyc to inform me.,0
AI agent for online data collection,0
Skills assessment for coding will become legal risks,0
Widespread Relativism in IO,0
Can someone list the ways to cure burnout?,0
In what way will our lives benefit from sessions with an industrial psychologist?,0
